{
  "schemaVersion": 1,
  "id": "69aae9cb02b885281b31e28e",
  "title": "R36S // M8 Headless // Music Production Cyberdeck",
  "source": {
    "url": "https://www.reddit.com/r/cyberDeck/comments/1r4plwq/r36s_m8_headless_music_production_cyberdeck/",
    "site": "reddit",
    "label": null
  },
  "links": [],
  "images": [
    {
      "origin": "https://gyazo.com/badc7af429dc73a797b536c69f401d82",
      "originRaw": "https://gyazo.com/badc7af429dc73a797b536c69f401d82/raw",
      "id": "sha256:cef28072ab294e65f32e872c9196c14db7c261ef5be563d2e9d653998074a69a",
      "status": "ok",
      "width": 1080,
      "height": 810,
      "mime": "image/webp",
      "files": {
        "thumb": "img/ce/cef28072ab294e65f32e872c9196c14db7c261ef5be563d2e9d653998074a69a.thumb.webp",
        "full": "img/ce/cef28072ab294e65f32e872c9196c14db7c261ef5be563d2e9d653998074a69a.webp"
      },
      "fetchedAt": "2026-10-03T07:52:55.388Z"
    },
    {
      "origin": "https://gyazo.com/955d6a465cf2e7c3c6a265af4990980d",
      "originRaw": "https://gyazo.com/955d6a465cf2e7c3c6a265af4990980d/raw",
      "id": "sha256:713154bbce914bb15eeb263cc5e0b2f2d7d354d5c8fbeab1c2371a38a60dd2c1",
      "status": "ok",
      "width": 1080,
      "height": 810,
      "mime": "image/webp",
      "files": {
        "thumb": "img/71/713154bbce914bb15eeb263cc5e0b2f2d7d354d5c8fbeab1c2371a38a60dd2c1.thumb.webp",
        "full": "img/71/713154bbce914bb15eeb263cc5e0b2f2d7d354d5c8fbeab1c2371a38a60dd2c1.webp"
      },
      "fetchedAt": "2026-10-03T07:52:57.339Z"
    },
    {
      "origin": "https://gyazo.com/a1021579736ae9810692b48b51ab0d16",
      "originRaw": "https://gyazo.com/a1021579736ae9810692b48b51ab0d16/raw",
      "id": "sha256:745c5c087f986590aa03c27b8d0deca9c83bd0ff482247d42f569c23a8a14f3d",
      "status": "ok",
      "width": 1080,
      "height": 1440,
      "mime": "image/webp",
      "files": {
        "thumb": "img/74/745c5c087f986590aa03c27b8d0deca9c83bd0ff482247d42f569c23a8a14f3d.thumb.webp",
        "full": "img/74/745c5c087f986590aa03c27b8d0deca9c83bd0ff482247d42f569c23a8a14f3d.webp"
      },
      "fetchedAt": "2026-10-03T07:52:59.041Z"
    },
    {
      "origin": "https://gyazo.com/fa29c2940006ec99626914916ba0e33c",
      "originRaw": "https://gyazo.com/fa29c2940006ec99626914916ba0e33c/raw",
      "id": "sha256:3db3973be7735dbe35f9ea1356e9ed4fe6c457ee48357096850bf2982c2fbc71",
      "status": "ok",
      "width": 1080,
      "height": 810,
      "mime": "image/webp",
      "files": {
        "thumb": "img/3d/3db3973be7735dbe35f9ea1356e9ed4fe6c457ee48357096850bf2982c2fbc71.thumb.webp",
        "full": "img/3d/3db3973be7735dbe35f9ea1356e9ed4fe6c457ee48357096850bf2982c2fbc71.webp"
      },
      "fetchedAt": "2026-10-03T07:53:00.766Z"
    },
    {
      "origin": "https://gyazo.com/85f8be93f2dfa32a9c607a722eb75715",
      "originRaw": "https://gyazo.com/85f8be93f2dfa32a9c607a722eb75715/raw",
      "id": "sha256:d6f712188580a82279ae9be047ea00a2bdf50be6936cacfb552859060fc4f180",
      "status": "ok",
      "width": 1080,
      "height": 810,
      "mime": "image/webp",
      "files": {
        "thumb": "img/d6/d6f712188580a82279ae9be047ea00a2bdf50be6936cacfb552859060fc4f180.thumb.webp",
        "full": "img/d6/d6f712188580a82279ae9be047ea00a2bdf50be6936cacfb552859060fc4f180.webp"
      },
      "fetchedAt": "2026-10-03T07:53:02.740Z"
    },
    {
      "origin": "https://gyazo.com/d3f0a2f43d93eab9d0b727b92d8cd5ad",
      "originRaw": "https://gyazo.com/d3f0a2f43d93eab9d0b727b92d8cd5ad/raw",
      "id": "sha256:2e8dc0ff9574de1342f94f0ffc67723087414b2a9780089e8091ef1f7de00019",
      "status": "ok",
      "width": 1080,
      "height": 810,
      "mime": "image/webp",
      "files": {
        "thumb": "img/2e/2e8dc0ff9574de1342f94f0ffc67723087414b2a9780089e8091ef1f7de00019.thumb.webp",
        "full": "img/2e/2e8dc0ff9574de1342f94f0ffc67723087414b2a9780089e8091ef1f7de00019.webp"
      },
      "fetchedAt": "2026-10-03T07:53:04.476Z"
    },
    {
      "origin": "https://gyazo.com/b29488d637210a61f0a84205da975cd6",
      "originRaw": "https://gyazo.com/b29488d637210a61f0a84205da975cd6/raw",
      "id": "sha256:1e46e260f4b2289457bd4bbdafdca957dcd31a7dcfe0a82d74ed8c0550cc3098",
      "status": "ok",
      "width": 1080,
      "height": 810,
      "mime": "image/webp",
      "files": {
        "thumb": "img/1e/1e46e260f4b2289457bd4bbdafdca957dcd31a7dcfe0a82d74ed8c0550cc3098.thumb.webp",
        "full": "img/1e/1e46e260f4b2289457bd4bbdafdca957dcd31a7dcfe0a82d74ed8c0550cc3098.webp"
      },
      "fetchedAt": "2026-10-03T07:53:06.020Z"
    },
    {
      "origin": "https://gyazo.com/215f8765e226189c47472048e4b2ff6f",
      "originRaw": "https://gyazo.com/215f8765e226189c47472048e4b2ff6f/raw",
      "id": "sha256:e7c04215c29965e765b323801e18703d97d5fae503dd0f82b328e2d250f512d0",
      "status": "ok",
      "width": 1080,
      "height": 810,
      "mime": "image/webp",
      "files": {
        "thumb": "img/e7/e7c04215c29965e765b323801e18703d97d5fae503dd0f82b328e2d250f512d0.thumb.webp",
        "full": "img/e7/e7c04215c29965e765b323801e18703d97d5fae503dd0f82b328e2d250f512d0.webp"
      },
      "fetchedAt": "2026-10-03T07:53:07.526Z"
    },
    {
      "origin": "https://gyazo.com/93133e9ef5bbb8b6f0bb0fd4dd007a64",
      "originRaw": "https://gyazo.com/93133e9ef5bbb8b6f0bb0fd4dd007a64/raw",
      "id": "sha256:812e5e83ca35ce5000ec4589edb036708f36d254bba328d4618f9a57e08a14d7",
      "status": "ok",
      "width": 1080,
      "height": 810,
      "mime": "image/webp",
      "files": {
        "thumb": "img/81/812e5e83ca35ce5000ec4589edb036708f36d254bba328d4618f9a57e08a14d7.thumb.webp",
        "full": "img/81/812e5e83ca35ce5000ec4589edb036708f36d254bba328d4618f9a57e08a14d7.webp"
      },
      "fetchedAt": "2026-10-03T07:53:08.746Z"
    },
    {
      "origin": "https://gyazo.com/412c6a8e1a2f80503e1a46f0da0e31b7",
      "originRaw": "https://gyazo.com/412c6a8e1a2f80503e1a46f0da0e31b7/raw",
      "id": "sha256:f367531614bd7975b054f8907233eba60ee187eb7ef1401d80bad0f1ed3cf2ff",
      "status": "ok",
      "width": 1080,
      "height": 1440,
      "mime": "image/webp",
      "files": {
        "thumb": "img/f3/f367531614bd7975b054f8907233eba60ee187eb7ef1401d80bad0f1ed3cf2ff.thumb.webp",
        "full": "img/f3/f367531614bd7975b054f8907233eba60ee187eb7ef1401d80bad0f1ed3cf2ff.webp"
      },
      "fetchedAt": "2026-10-03T07:53:10.548Z"
    },
    {
      "origin": "https://gyazo.com/604bc577976c42bbd9b0b98adc6fbc53",
      "originRaw": "https://gyazo.com/604bc577976c42bbd9b0b98adc6fbc53/raw",
      "id": "sha256:b3b30eb8e5550ebd1e943cee8a2a3467fea5028699c2e162bdeb3523010a6fb3",
      "status": "ok",
      "width": 1080,
      "height": 810,
      "mime": "image/webp",
      "files": {
        "thumb": "img/b3/b3b30eb8e5550ebd1e943cee8a2a3467fea5028699c2e162bdeb3523010a6fb3.thumb.webp",
        "full": "img/b3/b3b30eb8e5550ebd1e943cee8a2a3467fea5028699c2e162bdeb3523010a6fb3.webp"
      },
      "fetchedAt": "2026-10-03T07:53:12.376Z"
    }
  ],
  "tags": [],
  "related": [],
  "comment": null,
  "scrapbox": {
    "url": "https://scrapbox.io/CYBERDECK/R36S%20%2F%2F%20M8%20Headless%20%2F%2F%20Music%20Production%20Cyberdeck",
    "created": "2026-03-06T14:51:14.000Z",
    "updated": "2026-03-06T14:52:19.000Z",
    "views": 10,
    "thumbnail": "https://gyazo.com/badc7af429dc73a797b536c69f401d82/raw"
  }
}
