{
  "schemaVersion": 1,
  "id": "65e189f826c67e00244faffb",
  "title": "Xユーザーのmimi UMPCさん: 「自作ポケコン3号機が完成！ 充電モジュールの仕様に悩まされたけど何とか解決して良かった〜♪中身vim4なので2号機(黒PiZero2W)よりサクサク動作します 今回は縦長なので落下防止用にストラップホールを付けました |･ω･`)レトロフューチャー万歳☆ t.co/TeJnpkppwz」 / X",
  "source": {
    "url": "https://twitter.com/mimi_umpc/status/1720671959326048327",
    "site": "twitter",
    "label": "Xユーザーのmimi_UMPCさん: 「自作ポケコン3号機が完成！ 充電モジュールの仕様に悩まされたけど何とか解決して良かった〜♪中身vim4なので2号機(黒PiZero2W)よりサクサク動作します 今回は縦長なので落下防止用にストラップホールを付けました |･ω･`)レトロフューチャー万歳☆ https://t.co/TeJnpkppwz」 / X"
  },
  "links": [],
  "images": [
    {
      "origin": "https://scrapbox.io/files/65e189fde25eb000256e5843.png",
      "originRaw": "https://scrapbox.io/files/65e189fde25eb000256e5843.png",
      "id": "sha256:9a6c9b1e84953171374a23d3473df2ff3c27f97176d7e0c720519986fdde2a55",
      "status": "ok",
      "width": 1600,
      "height": 1600,
      "mime": "image/webp",
      "files": {
        "thumb": "img/9a/9a6c9b1e84953171374a23d3473df2ff3c27f97176d7e0c720519986fdde2a55.thumb.webp",
        "full": "img/9a/9a6c9b1e84953171374a23d3473df2ff3c27f97176d7e0c720519986fdde2a55.webp"
      },
      "fetchedAt": "2026-10-02T18:05:45.367Z"
    }
  ],
  "tags": [],
  "related": [],
  "comment": null,
  "scrapbox": {
    "url": "https://scrapbox.io/CYBERDECK/X%E3%83%A6%E3%83%BC%E3%82%B6%E3%83%BC%E3%81%AEmimi%20UMPC%E3%81%95%E3%82%93%3A%20%E3%80%8C%E8%87%AA%E4%BD%9C%E3%83%9D%E3%82%B1%E3%82%B3%E3%83%B33%E5%8F%B7%E6%A9%9F%E3%81%8C%E5%AE%8C%E6%88%90%EF%BC%81%20%E5%85%85%E9%9B%BB%E3%83%A2%E3%82%B8%E3%83%A5%E3%83%BC%E3%83%AB%E3%81%AE%E4%BB%95%E6%A7%98%E3%81%AB%E6%82%A9%E3%81%BE%E3%81%95%E3%82%8C%E3%81%9F%E3%81%91%E3%81%A9%E4%BD%95%E3%81%A8%E3%81%8B%E8%A7%A3%E6%B1%BA%E3%81%97%E3%81%A6%E8%89%AF%E3%81%8B%E3%81%A3%E3%81%9F%E3%80%9C%E2%99%AA%E4%B8%AD%E8%BA%ABvim4%E3%81%AA%E3%81%AE%E3%81%A72%E5%8F%B7%E6%A9%9F(%E9%BB%92PiZero2W)%E3%82%88%E3%82%8A%E3%82%B5%E3%82%AF%E3%82%B5%E3%82%AF%E5%8B%95%E4%BD%9C%E3%81%97%E3%81%BE%E3%81%99%20%E4%BB%8A%E5%9B%9E%E3%81%AF%E7%B8%A6%E9%95%B7%E3%81%AA%E3%81%AE%E3%81%A7%E8%90%BD%E4%B8%8B%E9%98%B2%E6%AD%A2%E7%94%A8%E3%81%AB%E3%82%B9%E3%83%88%E3%83%A9%E3%83%83%E3%83%97%E3%83%9B%E3%83%BC%E3%83%AB%E3%82%92%E4%BB%98%E3%81%91%E3%81%BE%E3%81%97%E3%81%9F%20%7C%EF%BD%A5%CF%89%EF%BD%A5%60)%E3%83%AC%E3%83%88%E3%83%AD%E3%83%95%E3%83%A5%E3%83%BC%E3%83%81%E3%83%A3%E3%83%BC%E4%B8%87%E6%AD%B3%E2%98%86%20t.co%2FTeJnpkppwz%E3%80%8D%20%2F%20X",
    "created": "2024-03-01T07:55:37.000Z",
    "updated": "2024-03-01T07:55:47.000Z",
    "views": 6,
    "thumbnail": "https://scrapbox.io/files/65e189fde25eb000256e5843.png"
  }
}
