{
  "schemaVersion": 1,
  "id": "679cdba6e25d9ee046af2011",
  "title": "New boy joins the family : r/cyberDeck",
  "source": {
    "url": "https://www.reddit.com/r/cyberDeck/comments/1i0ls9h/new_boy_joins_the_family/",
    "site": "reddit",
    "label": "New boy joins the family : r/cyberDeck"
  },
  "links": [],
  "images": [
    {
      "origin": "https://scrapbox.io/files/679cdba924f15a7e85d73271.png",
      "originRaw": "https://scrapbox.io/files/679cdba924f15a7e85d73271.png",
      "id": "sha256:3706a5a74b57850764b0e6fcb53bebc984d1050604de7019c7736057c5e290db",
      "status": "ok",
      "width": 1080,
      "height": 1440,
      "mime": "image/webp",
      "files": {
        "thumb": "img/37/3706a5a74b57850764b0e6fcb53bebc984d1050604de7019c7736057c5e290db.thumb.webp",
        "full": "img/37/3706a5a74b57850764b0e6fcb53bebc984d1050604de7019c7736057c5e290db.webp"
      },
      "fetchedAt": "2026-10-02T18:06:36.468Z"
    }
  ],
  "tags": [],
  "related": [],
  "comment": null,
  "scrapbox": {
    "url": "https://scrapbox.io/CYBERDECK/New%20boy%20joins%20the%20family%20%3A%20r%2FcyberDeck",
    "created": "2025-01-31T14:18:14.000Z",
    "updated": "2025-01-31T14:18:23.000Z",
    "views": 3,
    "thumbnail": "https://scrapbox.io/files/679cdba924f15a7e85d73271.png"
  }
}
